10.008,Catriona: Patient zeigt Übermaß an Selbstüberschätzung und hat gestörte Realitätswahrnehmung. Resozialisierungsprogramm ist überdenkenswert.,Catriona: I see that the patient has an exaggerated opinion of himself and a disturbed perception of reality. Resocialization program is worth considering.,Resonance1_15A_Set06_Cut.mp3
5.928,Robert: Ich sehe woraufhin Sie hinauswollen. Aber so funktioniert das nicht.,Robert: I can see where you're going with this. But it doesn't work this way.,Resonance1_16A_Set06_Cut.mp3
9.888,"Catriona: Vielleicht fällt Ihnen ja zu unserem nächsten Treffen eine bessere Masche ein. Dann überlege ich mir das mit dem Kaffee vielleicht. Und kleiner Tipp, laden sie mich doch auf einen Tee ein.","Catriona: Maybe you will come up with a better idea for our next meeting. Then maybe I'll think about the coffee. And a little hint, why don't you invite me for a cup of tea?",Resonance1_17A_Set06_Cut.mp3
5.472,"Robert: Das werde ich. Denken Sie nicht, dass sie mir so leicht davon kommen Cat.","Robert: I will. Don't think you can get away with it so easily, Cat.",Resonance1_18A_Set06_Cut.mp3
5.472,Catriona: Nun für heute denke ich haben wir erstmal genug gesehen. Bis nächste Woche Mister Wallace.,"Catriona: Well, for today I think we've seen enough. See you next week, Mr Wallace.",Resonance1_19A_Set06_Cut.mp3
4.800,"Robert: Wow, was für eine Frau.","Robert: Wow, what a woman.",Resonance1_20A_Set06_Cut.mp3